Author,Title,Text,Language,External Links,Mentioned Persons (positive),Mentioned Persons (negative),Mentioned Persons (neutral),Mentioned Persons (none),Mentioned Locations,Mentioned Organizations (positive),Mentioned Organizations (negative),Mentioned Organizations (neutral),Mentioned Organizations (none),Thread Link,Title,Section Link,Section Title,Thread Publication Date,Comments Count,Participants Count,Site Type,Site Name,Site Country,Main Image,Performance Score,Rating
Lee Speigel,Giant 'Styrofoam' Planet Could Help Scientists Find New Habitable Worlds,"05/25/2017 05:13 pm ET | Updated 3 days ago Giant 'Styrofoam' Planet Could Help Scientists Find New Habitable Worlds The huge, ""puffy"" planet has the same density as styrofoam. By Lee Speigel 
We’re all pretty familiar with objects made from styrofoam. Our daily lives intersect with disposable items like coffee cups, insulation, hot and cold coolers and those seemingly millions of little cushioning styrofoam-y “things” that are put into mailing boxes to protect the more valuable contents. 
And styrofoam balls are often used in arts and crafts to create models of the planets for hanging mobiles in bedrooms, classrooms and museums around the world. Left: Saurbh R Patil/Wikimedia Commons / Right: Marc Dantonio/FX Models While scientists investigate a recently discovered styrofoam ""puffy planet,"" styrofoam balls (left: Saurabh R. Patil/Wikimedia Commons) are enormously popular in the creation of the planets of our solar system (right: Marc Dantonio/FX Models) 
But, now, who would’ve guessed? Researchers at Lehigh University in Bethlehem, Pennsylvania, recently discovered a planet approximately 320 light-years from Earth that, according to a university statement , “has the density of styrofoam.” 
And the planet could be useful for scientists looking to discover new habitable worlds. 
“This ‘puffy planet’ outside our solar system may hold opportunities for testing atmospheres that will be useful when assessing future planets for signs of life,” the statement said. 
A global effort of university researchers, observatories and amateur astronomers resulted in an online paper published in The Astronomical Journal . The paper describes initial findings of the planet dubbed KELT-11b, which orbits the bright, subgiant star, KELT-11. 
“It is highly inflated, so that while it’s only a fifth as massive as Jupiter, it is nearly 40 percent larger, making it about as dense as styrofoam, with an extraordinarily large atmosphere,” said Lehigh University astronomer and team leader Joshua Pepper . 
But it’s not just the styrofoam-like similarity of the planet that intrigues scientists. The star ― KELT-11 ― that KELT-11b orbits plays an important role. The star is so bright, as seen from Earth’s southern hemisphere, that it can shed light ― literally ― on KELT-11b’s atmosphere. The high brightness of the star shining through the atmosphere of the planet allows Earth-based equipment to better observe the planet’s atmosphere. 
“That’s a process called transmission spectroscopy , where we measure the atmosphere by measuring the light of the star that gets filtered through the outer layers of the planet’s atmosphere,” Pepper told HuffPost. 
“The planet goes in front of the star and a little bit of the light from the star passes through it. The atmosphere imprints on that light certain color patterns that are associated with the material in the atmosphere. Whether there’s oxygen, or carbon dioxide, methane or ammonia, you can actually see those patterns, even if we can’t see the planet itself.” 
This, in turn, gives astronomers the ability to develop new tools to help them determine if Earth-like planets are surrounded by atmospheres that might allow life to evolve. 
KELT stands for Kilodegree Extremely Little Telescope , referring to two small robotic telescopes ― one in Arizona and one in South Africa, both built by Pepper ― that scan the night sky, taking measurements of 5 million stars. Those who monitor the data searching for possible planets are looking for the type of star that becomes dimmer at regular times. This might indicate the presence and movement of a planet crossing the star, producing an eclipse effect. Photo courtesy of Joshua Pepper The KELT-South robotic telescope in South Africa that made the discovery of KELT-11b. 
If researchers want to learn more about KELT-11b, they’d better hurry. 
Well, sort of. 
The “styrofoam” giant is so close to its parent sun that it takes less than five days to orbit KELT-11. KELT-11 has begun depleting its nuclear fuel as it evolves into a red giant, and at this rate, it will eventually envelop its puffy partner within the next 100 million years. 
The Lehigh research team says the KELT discovery will prove to be an important target to learn more about how atmospheres are formed in the search for habitable worlds. 
What’s next to be discovered out there in the cosmos? A plastic asteroid? ALSO ON HUFFPOST Artists' Conceptions Of Extrasolar Planets Artists' Conceptions Of Extrasolar Planets Artists' Conceptions Of Extrasolar Planets 1 12 New Super-Earth Discovered 39 Light-Years From Earth In April 2017 researchers at the Harvard-Smithsonian Center for Astrophysics CfA announced the discovery of a new super-Earth designated LHS 1140b orbiting the habitable zone of a small red dwarf star LHS 1140 about 39 light-years away Its 42 light-years from our sun to the nearest star Proxima Centauri This is an artist impression of the star LHS 1140 and the possible super-Earth planet which shows early indications of habitability Share this slide:",english,,,,,,,,,,,http://omgili.com/ri/jHIAmI4hxg8kBMzlsF_JTjQdlO8_P5DHS7vvZzrbDOhY1CYK_1eKdOBvDiiCEyY.0nvC.v3zqSqNqUO_qqc5qPZBTO9pelsjgoGQHDh.4pRFyP9UOkm4J4wFzkNZCIPRpudlubmHw24-,Giant 'Styrofoam' Planet Could Help Scientists Find New Habitable Worlds,http://www.huffingtonpost.com/feeds/index.xml,The Huffington Post | The Full Feed,2017-05-26T05:13:00.000+03:00,0,1,news,huffingtonpost.com,US,http://img.huffingtonpost.com/asset/1910_1000/5925a7441600002100ddc997.jpeg,0,
Arthur Delaney,"Contra Mick Mulvaney, People Know Disability Is Part Of Social Security","05/25/2017 05:08 pm ET Contra Mick Mulvaney, People Know Disability Is Part Of Social Security Trump's budget director makes a tricky claim to argue proposed Social Security budget cuts don't break campaign promises. By Arthur Delaney , Daniel Marans 
WASHINGTON ― President Donald Trump ’s budget chief said repeatedly this week that when people think of Social Security, retirement insurance is the only thing that comes to mind ― not disability insurance. 
A “welfare program for the long-term disabled,” Office of Management and Budget Director Mick Mulvaney said on Tuesday, “is not what most people would consider to be Social Security.” 
Social Security is best known as retirement insurance, but plenty of people are aware that it’s also disability insurance. Forty-three percent of survey respondents said they knew someone who received disability or survivors’ benefits from Social Security, according to a 2010 poll by AARP . (Asked if they knew someone simply “on Social Security,” more than two-thirds said they did.) 
Mulvaney insisted disability insurance shouldn’t count as Social Security because President Donald Trump promised during the campaign that he would never support cutting Social Security, Medicare or Medicaid. Trump’s budget, which Mulvaney unveiled this week, breaks that promise by proposing cuts to both Medicaid and Social Security. Because it doesn’t target Social Security’s retirement insurance component, Mulvaney dubiously claims the proposal doesn’t break Trump’s promise. 
“If you ask 999 people out of 1,000, [they] would tell you that Social Security disability is not part of Social Security,” Mulvaney said on Monday. “It’s old-age retirement that they think of when they think of Social Security.” 
If 43 percent of Americans have heard of Social Security Disability Insurance, per the AARP poll, then that means Mulvaney’s assertion is not correct. Aaron Bernstein / Reuters White House budget director Mick Mulvaney did his best to claim that Donald Trump's proposed cuts to Social Security Disability Insurance do not violate his campaign promises. 
And, as the progressive think tank Center on Budget and Policy Priorities notes , even Republicans amenable to cutting Social Security Disability Insurance have talked about the program as a basic part of Social Security. 
“Social Security provides vital financial support for more than 57 million beneficiaries,” House Speaker Paul Ryan’s (R-Wis.) congressional website says . “Social Security also provides critical benefits to widows and those with disabilities.” 
As a teenager, Ryan and his mother received Social Security survivors’ benefits after his father’s death, another element of the program that Mulvaney’s narrower definition of Social Security excludes. 
Getting the benefits “helped me pay for college, it helped her go back to college in her 50s where she started a small business because of the new skills she got,” Ryan recalled during the 2012 vice presidential debate . 
Sen. Lindsey Graham (R-S.C.) has also discussed the importance of Social Security survivors’ benefits for his younger sister, when both their parents died in a short span of time. 
And Rep. Sam Johnson (R-Texas), chairman of the Social Security subcommittee on the House Ways and Means Committee, has spoken about the program as a crucial source of insurance in the event of a severe disability. 
“For years I’ve talked about the need to fix Social Security so that our children and grandchildren can count on it to be there for them, just like it’s there for today’s seniors and individuals with disabilities,” Johnson said in December . 
In fact, it was a Republican who first created the Social Security Disability Insurance program. President Dwight D. Eisenhower expanded Social Security to cover workers with disabilities and their dependents in 1956. From that point on, Social Security became known as the Old-Age, Survivors and Disability Insurance program. 
The disability benefits part of Social Security was a natural extension of the program’s mission to enable workers to contribute toward a fund that would provide them income for times when they are no longer capable of working. Disability benefits, like Social Security retirement benefits, are based on a certain percentage of a worker’s previous earnings, rather than need, like some means-tested welfare programs. 
Some policy experts who helped conceive of Social Security in the 1930s favored making disability benefits part of the original program, according to a history on the Social Security Administration website . They were overruled by colleagues concerned about the cost of adding those benefits, and critics in the private disability insurance industry, delaying its passage for an additional two decades.   ALSO ON HUFFPOST 2017 Scenes From Congress & Capitol Hill 2017 Scenes From Congress & Capitol Hill 2017 Scenes From Congress & Capitol Hill 1 63 Budget Queries Office of Management and Budget Director Mick Mulvaney testifies before the House Budget Committee about President Donald Trump's fiscal 2018 budget proposal on Capitol Hill on May 24, 2017. Share this slide:",english,,,,,,,,,,,http://omgili.com/ri/jHIAmI4hxg8kBMzlsF_JTjQdlO8_P5DHS7vvZzrbDOjIBWdrMGgQS5Nkb9sZ00XFtjZNcGQSTOtEa.k2Bkt5jTj27GxmV.9ApUF7EvIs1GPtRYHp77TfqkM6Bf.D49gSNCHk5W7ffWSwwYRQnBA.aQ--,"Contra Mick Mulvaney, People Know Disability Is Part Of Social Security",http://www.huffingtonpost.com/feeds/index.xml,The Huffington Post | The Full Feed,2017-05-26T05:08:00.000+03:00,0,1,news,huffingtonpost.com,US,http://img.huffingtonpost.com/asset/1910_1000/59273219150000470015b6e2.jpeg?cache=d7f9mdcw7e,3,
OpenSecrets Blog,"Next Election Is Still 18 Months Away, But It’s Never Too Early To Collect Cash","United States Close Next Election Is Still 18 Months Away, But It’s Never Too Early To Collect Cash 05/25/2017 03:26 pm ET | Updated 7 hours ago (Photo By Bill Clark/CQ Roll Call) (CQ Roll Call via AP Images) Nevada Republican Sen. Dean Heller collected more cash from his colleagues in the first three months of the 2018 cycle than any other incumbent who’s considered vulnerable. 
by Sara Swann 
Even with the 2018 midterm elections still 18 months away, both Republicans and Democrats are making moves to strengthen their most vulnerable incumbents. 
One way they’re doing it: By contributing through their candidate committees and leadership PACs. Already, more than $3 million changed hands this way in the first three months of 2017 — nearly $2.6 million in the House and $769,000 in the Senate. 
These are the 2018 candidates who are the top recipients of funds from their colleagues: 
All of these candidates in some way have been pinpointed as vulnerable. In the House, all eight of the Republicans listed above are “ Round One ” targets for the Dems, and are also in the Patriot Program, organized by the National Republican Congressional Committee to support candidates facing particularly challenging elections. The two Democrats have been added to the Democratic Congressional Campaign Committee’s similar Frontline Program. 
Currently the GOP holds the majority in the House by a wide margin — 241 seats to the Democrats’ 194. Thirty-four seats in the Senate will be on the ballot. But the president’s party usually loses seats in Congress in the midterm elections. 
To gain a majority in the Senate, the Democrats will have to cling to its 25 seats that are up for re-election and fight for three more. (Two of the 25 are held by Independents who caucus with the Democrats.) Republicans, meanwhile, have their eyes on a 60-seat supermajority so they can block Democratic filibusters (that’s if filibuster rules still exist by 2019). To get there, they would need eight more seats and couldn’t lose any of their nine incumbents up for re-election. 
While the Democrats’ goal in the Senate might be gettable, winning the House would be a reach, said Laurel Harbridge Yong, an associate professor of political science at Northwestern University. That’s partly due to a “bad map,” she noted: Where people live across the country and how they’re divided up into House districts in general leans more in favor of Republicans, she said, and that’s not just from gerrymandering; it also has to do with the fact that a lot of Democratic voters are concentrated in cities, rather than spread out in rural areas like GOP voters often are. 
“The tricky thing is what are the Republicans going to accomplish between now and the election?” Harbridge Yong said. “They probably aren’t going to get a lot done due to in-party fighting, in which case the Democrats can say, ‘you had control and you didn’t do anything.'” 
The most vulnerable candidates in the upcoming election, Harbridge Yong said, are the people whose partisanship doesn’t align with how their state voted in the 2016 presidential election. 
Sen. Dean Heller (R-Nev.), the lawmaker who has received the most funding so far from his colleagues, is looking at what’s expected to be one of the most difficult races in 2018. He is the only Republican senator up for re-election in a state that voted for Hillary Clinton in 2016. This makes him one of the primary targets for the Democrats, who are desperately reaching for the Senate majority. 
Twelve different politicians have contributed to Heller’s campaign so far to give him his $79,000 total. His top four supporters are Sen. Bob Corker (R-Tenn.), Sen. Ted Cruz (R-Texas), Sen. Deb Fischer (R-Neb.) and Sen. Cory Gardner (R-Colo.), who each gave $10,000 through their separate leadership PACs — $5,000 for the primary and the same for the general election. 
On the flip side, 10 Democratic senators, including Bill Nelson (D-Fla.) and Jon Tester (D-Mont.), are up for re-election in states Donald Trump won. 
The top donor to his colleagues, naturally enough, is a member of the leadership. Speaker Paul Ryan (R-Wis.) has given a cool $564,000 to his fellow House members. House Majority Leader Kevin McCarthy (R-Calif.) has given $317,000, including $112,000 to the eight GOP House candidates on our list of top recipients; he contributed $10,000 to each of the eight through his Majority Committee PAC , and they all got another $4,000 each from the Californian’s campaign committee . 
On the Democratic side, Minority Leader Nancy Pelosi (D-Calif.) has provided her flock with $279,000 from her leadership PAC, PAC to the Future , and her candidate committee , including $28,000 to the Democrats who are among the top 10 recipients. Like McCarthy with his Republicans, Pelosi gave $10,000 to each of those candidates through her PAC, and through her campaign committee she gave another $4,000 each. 
Among senators, Tim Kaine (D-Va.) has been the most generous, redistributing $97,500 from his leadership PAC, including $20,000 to those on our leader board. 
While leadership PACs can give $5,000 per election, candidate committees can only give $2,000 (so $4,000 for the primary and general together). McCarthy, Pelosi and several other believers in early money have already maxed out what they can give directly to some of their colleagues for 2018. Do you have information you want to share with HuffPost? Here’s how. MORE:",english,,,,,,,,,,,http://omgili.com/ri/jHIAmI4hxg8kBMzlsF_JTjQdlO8_P5DHS7vvZzrbDOgdZrBxfJToFGcpVUI7SEHIUYMtRbdRYejVpixFN0FFX00mjweyrS3gkX_.b.SyPnwHeguXtU5YKRRQfyySHVCyusF5zG8m6ajSuA4n7ugtFXcjiT_vgHs_,"Next Election Is Still 18 Months Away, But It’s Never Too Early To Collect Cash",http://www.huffingtonpost.com/feeds/verticals/politics/index.xml,Politics - The Huffington Post,2017-05-26T03:26:00.000+03:00,0,1,news,huffingtonpost.com,US,http://img.huffingtonpost.com/asset/1910_1000/59272fb6200000190016eecc.jpg,0,
OpenSecrets Blog,"Montana Race, Now Complicated, Sets Spending Record For House Contests In State","United States Close Montana Race, Now Complicated, Sets Spending Record For House Contests In State Gianforte’s recent arrest for assault muddies the waters. 05/25/2017 04:13 pm ET | Updated 7 hours ago (AP Photo/Matt Volz, File) GOP technology entrepreneur Greg Gianforte’s chances of winning a House election likely didn’t improve when assault charges were filed against him Wednesday. Gianforte, his opponent Rob Quist (D) and outside spending groups have made this Montana special election the most expensive battle for a House seat in the state’s history. 
By Sara Swann 
The cost of the House special election race in Montana — where voters are going to the polls today — is officially record-breaking. 
It’s unclear how Wednesday’s misdemeanor assault charges against the Republican candidate, Greg Gianforte, will affect the outcome, particularly since a large number of voters cast their ballots before today. It’s very clear, though, that this race has been a magnet for donors: Gianforte, a wealthy software entrepreneur, and his Democratic opponent Rob Quist, a folk singer, together raised $6.7 million through May 5, and another almost $900,000 from then through May 22. 
Spending by the candidates stood at $5.2 million as of May 5, the date on the most recent reports of their expenditures. 
And outside spending in the race has soared to $7.2 million, with $1.4 million of that coming in just the nine days between May 17-25. Combined with the somewhat dated candidate spending figure, that brings the cost of this faceoff to a minimum of $12.4 million, more than has been spent on any House race in the state going back at least as far as 1990. 
While a vast majority of Quist’s individual contributions have been $200 and under , Gianforte has mostly seen larger individual contributions of $2,000 plus . Hidden in Gianforte’s 48-hour contribution notices, which list all contributions of $1,000 or more, is a $500,000 donation he made to himself . That’s on top of an earliler $1 million loan he made to his campaign. Quist has not made any contributions to his campaign, save the $140 he reported before April. 
Republican party committees and super PACs have continued to dominate the outside spending in this special election to replace now-Interior Secretary Ryan Zinke. The top three outside spenders in the election — the Congressional Leadership Fund , the National Republican Congressional Committee and the Republican National Committee — all have Republican ties; together they spent $5.6 million backing Gianforte. Pro-Quist outside spending groups altogether have spent less than $1 million. 
The Democratic candidate recruited the support of Sen. Bernie Sanders (I-Vt.) for one of his campaign events in mid-May, drawing thousands to the rally. In the 2016 primary election, Montana voted for Sanders over former Secretary of State Hillary Clinton . 
During one of his rallies, Gianforte was accompanied by Donald Trump, Jr. and Vice President Mike Pence. In his previous unsuccessful bid for Montana governor in 2016, Gianforte distanced himself from Donald Trump . But since Trump won the election in November, and was especially popular in Montana, Gianforte has aligned himself more closely to the president. 
Like other special elections, the one in Montana has been viewed as a referendum on Trump. However, Gianforte’s recent arrest for assault muddies the waters. Late on Wednesday night, Guardian reporter Ben Jacobs tweeted he had been “body slammed” by Gianforte after asking him a question about the Republican health care plan. Audio of the incident was later released in which Gianforte can be heard yelling at Jacobs to “get the hell out of here.” The GOP candidate was arrested and charged with misdemeanor assault after Jacobs reported the incident to authorities, and a Fox News crew that witnessed the altercation corroborated Jacobs’ allegations. 
Some state newspapers immediately withdrew their endorsements of Gianforte, but about 37 percent of Montana’s registered voters had already committed to one or the other candidate, having sent their ballots in early. The polls will close at 10 p.m. Eastern time. Do you have information you want to share with HuffPost? Here’s how. MORE:",english,,,,,,,,,,,http://omgili.com/ri/jHIAmI4hxg8kBMzlsF_JTjQdlO8_P5DHS7vvZzrbDOiiEnt3k94RaSrNXV8B_VqvukstPX7PGHhpk4BQFvT0OsaB8Tq1HYy5bo_Z9eaW4r7ddhP39W9hjmjO4seAK_rFmhArFc3dtkaCp_rC9NwH_lxAplIp8e9q,"Montana Race, Now Complicated, Sets Spending Record For House Contests In State",http://www.huffingtonpost.com/feeds/verticals/politics/index.xml,Politics - The Huffington Post,2017-05-26T04:13:00.000+03:00,0,1,news,huffingtonpost.com,US,http://img.huffingtonpost.com/asset/1910_1000/59273aaa1600008c1cddce17.jpg,0,
Tanisha Ramirez,Graduates Honor Their Immigrant Roots With Inspirational #ImmiGrad Posts,"05/25/2017 05:22 pm ET | Updated May 25, 2017 Graduates Honor Their Immigrant Roots With Inspirational #ImmiGrad Posts ""I am a product of their hard work, of their sacrifices, and endless love."" By Tanisha Love Ramirez 
With graduation season in full swing, immigrant graduates and children of immigrants across the country are reflecting on the roads and people who led them to where they are today. 
Last week, Define American ― a non-profit media and culture organization― partnered with Undocumedia to put out a call on social media encouraging graduates from immigrant families to share their personal stories using #ImmiGrad. The class of 2017 quickly obliged, posting sweet photos, touching anecdotes and heartwarming messages thanking their parents for their support, dedication and love. 
Grab a box of tissues, and check out some of their posts below. A post shared by Kim Aguilar (@kcaguilar02) on May 13, 2017 at 7:20pm PDT A post shared by Jackie Carbajal✨ (@_geejackiee) on May 21, 2017 at 4:05pm PDT A post shared by Aldair Arriola-Gomez (@aldiarriola) on May 22, 2017 at 5:58pm PDT A post shared by MSG (c) (@insta_gabee) on May 24, 2017 at 9:56am PDT A post shared by F-Land (@f_land711) on May 23, 2017 at 1:03am PDT A post shared by Minué (@miinue) on May 22, 2017 at 10:08am PDT A post shared by Yesenia?? (@yesig_) on May 21, 2017 at 1:44pm PDT A post shared by Jassi Bassi (@jassi.kbassi) on May 20, 2017 at 7:19pm PDT A post shared by María ???? (@twinone_) on May 20, 2017 at 10:52pm PDT A post shared by ??⚽️??????????➡️@drogo_the_sheprador (@mabe420) on May 10, 2017 at 7:43am PDT A post shared by Ana Cuevas (@anabananaz8) on May 21, 2017 at 5:39pm PDT A post shared by Randy Villegas (@randy43841) on May 14, 2017 at 4:46pm PDT A post shared by Uriel Zarate (@zarate_805) on May 17, 2017 at 11:43pm PDT ALSO ON HUFFPOST Immigrants Proudly Share Their American Stories On Twitter With #ImAlreadyHome 67 Immigrants Proudly Share Their American Stories On Twitter With #ImAlreadyHome 1 67 Share this slide: I'm an immigrant, son of a farmworker, & honored to serve as a U.S. Congressman. We should all have this opportunity. #ImAlreadyHome pic.twitter.com/bi54szApXF ",english,,,,,,,,,,,http://omgili.com/ri/jHIAmI4hxg8kBMzlsF_JTjQdlO8_P5DHS7vvZzrbDOg1XmNy3oAERaI77sUyl1hpAcUcidp3oMVrMwLf0YyPKlGeuNjVbuWwy2ix75TgPj82J.61F33rV8DV07clDRjQbhv6srm_EiIlObb4WRL9UxD0fyA7qygi19pDSxiSc359LHIUmqbqqA--,Graduates Honor Their Immigrant Roots With Inspirational #ImmiGrad Posts,http://www.huffingtonpost.com//feeds/index.xml,The Huffington Post | The Full Feed,2017-05-26T05:22:00.000+03:00,0,1,news,huffingtonpost.com,US,http://img.huffingtonpost.com/asset/1910_1000/59273604150000470015b6f0.png,0,
