Author,Title,Text,Language,External Links,Mentioned Persons (positive),Mentioned Persons (negative),Mentioned Persons (neutral),Mentioned Persons (none),Mentioned Locations,Mentioned Organizations (positive),Mentioned Organizations (negative),Mentioned Organizations (neutral),Mentioned Organizations (none),Thread Link,Title,Section Link,Section Title,Thread Publication Date,Comments Count,Participants Count,Site Type,Site Name,Site Country,Main Image,Performance Score,Rating
Zahara Hill,Single Dad Hosts Class For Men To Learn To Do Their Daughters' Hair,"Single Dad Hosts Class For Men To Learn To Do Their Daughters' Hair The dad is sharing his knowledge with fellow fathers. By Zahara Hill 
When Darious Bland became a single father seven years ago, he was at a loss as to how to go about doing his daughter’s hair. He’s since picked up a few tricks, and now the Alabama native is sharing them with his fellow dads. 
On May 21, Bland held a hair workshop titled “Can Daddy Do My Hair?” in Hunstsville, AL. 
The event allowed 12 dads to come with their 3- to 10-year-old daughters as Bland guided them in navigating the understated difficulty of styling black hair. 
“These dads are learning a lot; not only about hair but what many moms go through,” he told WHNT . “They didn’t understand the frustration that mothers have to go through while doing their daughters’ hair.” 
Videos of fathers doing their daughters’ hair have made their rounds on the internet throughout the years. And an April BBC News video showed health and well-being guru Khembe Clarke hosting a similar event for black fathers in England. 
As for Bland, he admits he still has a thing or two to learn. 
“I’m learning how to do flat twists, bantu knots, I want to learn how to braid,” he said. 
For those who couldn’t make the workshop, Bland also posts video tutorials on the event’s Facebook page. ALSO ON HUFFPOST 9 Movies That Perfectly Capture The Beauty Of Black Fatherhood 9 9 Movies That Perfectly Capture The Beauty Of Black Fatherhood 1 9 Willie Jones - ""Friday"" In ""Friday,"" John Witherspoon plays Willie Jones, the father of perpetual slacker Craig (Ice Cube). It's a character played mostly for laughs, but in one powerful moment when he discovers his son with a gun, he gives some profound advice on what it means to be a man: ""You kids today are nothing but punks... so quick to pick up a gun. Scared to take an ass-whooping. This [holding up fists] is what makes you a man. When I was growing up, this was all the protection you needed. You win some, you lose some. But you live to fight another day."" Share this slide: ",english,,,,,"darious bland , craig , zahara hill , willie jones , john witherspoon , khembe clarke , ","hunstsville , england , alabama , ",,,,"bbc news , beauty of black fatherhood , whnt , ",http://omgili.com/ri/jHIAmI4hxg8kBMzlsF_JTjQdlO8_P5DHS7vvZzrbDOj9wtf.5zMBkrEKFWB8DkSBY3HQftymmVTeCSHnpn2dSfj14p8Q6F7j1DDqjvQRRZihvXPBicYYuXTkKjXzPg.n6Arh0pj79XUzlJRE7q0acS7mgJJba5MUXyoEJmR2z1QcR0QpN3kLUQ--,Single Dad Hosts Class For Men To Learn To Do Their Daughters' Hair,http://www.huffingtonpost.com/feeds/verticals/impact/news.xml,Impact News on The Huffington Post,2017-05-26T02:09:00.000+03:00,0,1,news,huffingtonpost.com,US,http://img.huffingtonpost.com/asset/1910_1000/5926ff4b1600002200ddccf7.png,0,
Allison Fox,The 7 Injuries Doctors See Most On Summer Weekends,"The 7 Injuries Doctors See Most On Summer Weekends Stay safe out there. By Allison Fox Thomas Barwick via Getty Images 
Warm weather and longer days will bring many Americans outdoors for cookouts, pool parties and more. But long weekends ― we’re looking at you, Memorial Day ― also lead to more trips to urgent care or even the emergency room, according to experts. In fact, a 2015 study from researchers at Brown University found that heat-related illness alone can ratchet emergency department visits in the summertime. 
The risk for issues like drowning and sports injuries go up in the hotter seasons, according to Dr. Christopher M. McStay, chief of clinical operations and associate professor at the University of Colorado School of Medicine. And they’re usually all preventable. 
We asked doctors to explain the most common reasons why patients end up in their offices during summer months ― and what can be done to prevent you or a loved one from being among them. 1. Heat-related illness. 
During summer months, people often show up at the doctor with a heat-related condition, from mild dehydration to severe heatstroke, says Dawne Kort, an emergency medicine doctor and attending physician at CityMD Urgent Care Walk-In Medical Clinic. 
Fewer than 1,000 Americans die each year due to heat-related illness, according to a 2014 study by the Centers for Disease Control and Prevention. But plenty more experience the more mild symptoms of too much sun exposure, which include nausea, dizziness, headaches and confusion. 
“Be mindful of the temperature, stay hydrated and avoid being outside for prolonged periods of time if the temperature is high ― especially during the hottest time of the day ,” Kort told HuffPost, noting that the warmest hours are usually between 2 and 4 p.m. wundervisuals via Getty Images Doctors see an uptick in drowning incidents and water activity accidents in warmer months. 2. Swimming injuries and drowning. 
Memorial Day weekend is the first time many people will head out for water-related activities. 
“We see a fair amount of swimming-related [injuries],” McStay told HuffPost. “Trauma related to jumping into a body of water, small children who are not being supervised, boating injuries.” 
Joseph Perno, a pediatric emergency medicine physician at Johns Hopkins All Children’s Hospital in St. Petersburg, Florida, says these water-related dangers definitely increase when the weather gets warm. 
“We see a big spike in drowning,” Perno told HuffPost. “When you have a lot of adults together, you’d think there would be more people watching the kids but what happens is people are distracted: Talking, drinking, partying, having fun and no one is watching the kids.” 
Drowning is the second most common cause of death by unintentional injury, behind car accidents, among children ages 1-4 years-old, according to the U.S. Centers For Disease Control And Prevention. Children are also more likely to drown in a swimming pool than anywhere else. 
It’s so easy for a child to fall into water without someone realizing, Perno says. If you’re having a pool party, rotate having a designated adult to supervise water activities, he suggests. 3. Burns and cuts. 
There are numerous hospital visits for burns associated with grilling and camp fires, as well as cuts from kitchen knives, according to McStay. 
Children may try to touch the fires and adults make the common mistake of squirting lighter fluid onto hot coals. Be safe about it: Apply lighter fluid to coals when they aren’t lit, letting the fluid soak in, McStay suggests. Hero Images via Getty Images Back away from the coleslaw that's been sitting in the sun for hours on end. 4. Food poisoning and gastroenteritis. 
Gastrointestinal issues frequently bring people to the emergency room during warmer months, according to Kort. In fact, food-borne illnesses peak in the summer months, since hot temperatures and humid conditions provide the optimum breeding ground for bacteria to multiply rapidly, according to the U.S Department of Agriculture. 
“[It’s] commonly seen after a summer barbecue, where the food has not been properly cooked or may have been left out in the heat. Or when fruits and vegetables have not been washed properly,” Kort said. 
Be especially wary of food that’s been sitting out in the sun all day and wash your hands properly before eating, Kort advises. 5. Sports injuries 
Sports-related injuries from playing frisbee, football and outdoor activities are also a bigger issue. Sprained wrists, twisted ankles and broken bones are common sights in urgent care clinics and emergency rooms between spring and summer, according to the experts. 
Treatment for these injuries typically requires a little home care, Kort said. Rest the body, ice the injury, compress the body part and elevate the injured area. But if something feels seriously wrong or keeps getting worse, head to the doctor as soon as possible. Imgorthand via Getty Images Ticks and bug bites: 'Tis the season! 6. Skin irritations and insect bites. 
With long days spent outdoors, it’s common to see irritations from wild plants like poison ivy, sumac and oak. Insect and tick bites are also common and, in some cases of infection, may require an antibiotic, Kort said. 
This year, in particular, may bring with it more tick bites and tick-borne diseases than previous summers. And Zika virus, though currently out of the news cycle, may be poised to come back in some states . 
Keep an eye on any bumps or swelling that does not go away or grows in size. And learn some expert-backed tips to keep yourself safe from ticks and mosquitoes . 7. Sunburns. 
While most sunburns don’t require a trip to the hospital, some do. In 2013, there were nearly 34,000 emergency room visits in the U.S. due to serious sunburns, according to recent research in Dermatology. Go to the doctor if your sunburn results in blistering or is accompanied by nausea, confusion, headache, extreme pain or chills. You should also head to the doctor if at-home remedies such as applying aloe vera or taking a pain reliever like ibuprofen does not help after a couple of days. 
But even if you can take care of your burn at home, it’s an uncomfortable mishap that’s easy to avoid. 
Practice good sun protection habits for yourself and especially watch out for children you’re supervising, since they are unlikely to remember to reapply lotion. 
“Having a sunburn is uncomfortable and painful,” McStay said. “And the chronic risk of sun exposure and skin cancer is something to think about everyday.” 
So walk into the long, warm weekend a bit more alert. Better to be safe than sorry. ALSO ON HUFFPOST Allison Fox Lifestyle Trends Writer, HuffPost MORE:",english,,,,"allison fox thomas barwic , ","mcstay , huffpost , joseph perno , kort , perno , huffpost allison fox , dawne kort , burns , christopher m. mcstay , zika , ","u.s. , st. petersburg , florida , ",,,,"getty images  warm , brown university , centers for disease control and prevention , getty images back , johns hopkins all children’s hospital , u.s department of agriculture , citymd urgent care walk-in medical clinic , u.s. centers for disease control and prevention , university of colorado school of medicine , getty images ticks , ",http://omgili.com/ri/jHIAmI4hxg8kBMzlsF_JTjQdlO8_P5DHS7vvZzrbDOicftrB3wPhiLTMJvRHW3nR4fxMyW9FdmQI9tV6_o2DPcCaRGQo8LOgsS44aGDrY74tvKATeA8FW6YWmtinTcUc,The 7 Injuries Doctors See Most On Summer Weekends,http://www.huffingtonpost.com/feeds/news.xml,The Huffington Post | Full News Feed,2017-05-26T02:13:00.000+03:00,0,1,news,huffingtonpost.com,US,http://img.huffingtonpost.com/asset/1910_1000/59232b612000003200cb2020.jpeg,3,
Jenavieve Hatch,Grown Men Upset By Movie Theater Offering Women-Only Screening Of 'Wonder Woman',"05/25/2017 02:07 pm ET | Updated 11 hours ago Grown Men Upset By Movie Theater Offering Women-Only Screening Of 'Wonder Woman' You OK, guys? By Jenavieve Hatch Warner Bros 
An Austin-based movie theater has angered men for offering a women-only screening of the upcoming “Wonder Woman” film. 
In a Facebook post Wednesday, the movie theater announced the special screening, with a link back to an innocent and enthusiastic post about the event on its website. 
“The most iconic superheroine in comic book history finally has her own movie, and what better way to celebrate than with an all-female screening?” the announcement reads. “Apologies, gentlemen, but we’re embracing our girl power and saying ‘No Guys Allowed’ for one special night at the Alamo Ritz.” 
Like clockwork, angry men of the internet responded by calling the theater sexist for hosting a women-only screening of a movie that’s empowering for women. 
One man commented , “ Apparently ‘equality’ is only selective nowadays ... How about a ‘men’s only’ showing of a movie or is that not how equality works?” A nother offended gentleman said that it was “wrong,” and that he will “never set foot in [the] theater again.” 
Check out some of the comments below. Facebook 
And regardless of the fact that the theater is hosting dozens of other screenings for the film, some men on Twitter were also quick to take offense. Twitter Twitter Twitter 
Alamo responded to many of the commenters , even the angry ones, encouraging them to think twice about why this might be an exciting event for many women: 
We hate to lose your business, and it’s certainly your right to campaign against us. Humor us ― give it a day or so and consider this notion (it’s true, we promise): that the event is really just supposed to be a fun way for female fans of a comic book character that’s important to them symbolically to see a movie they’re excited about. There’s no political agenda intended, honest. 
Another Twitter user pointed out that the men’s complaints were futile ― the original women-only screening has apparently already sold out, prompting the theater to add more shows. We've added a 2nd screening of our WOMEN ONLY: WONDER WOMAN show here in Austin. Tickets are live now: https://t.co/P00kgkOogv pic.twitter.com/GGlzacIvmx — Alamo Drafthouse ATX (@drafthouse) May 25, 2017 
In a statement to HuffPost, Alamo representatives were enthusiastic about the screening and inspired by the “wrath of trolls” to continue providing an exciting experience for women ― and Alamo now plans on expanding the women-only screening options in its theaters nationwide. 
“We are very excited to present select, women-only Wonder Woman screenings at Alamo Drafthouse,” said Morgan Hendrix, Alamo Drafthouse creative manager, in the statement. “That providing an experience where women truly reign supreme has incurred the wrath of trolls only serves to deepen our belief that we’re doing something right. As a result, we will be expanding this program across the country and inviting women everywhere to join us as we celebrate this iconic superheroine in our theaters.” 
Representatives for Alamo also told HuffPost that proceeds from the ticket sales for their D.C., Austin and Dallas screenings will be donated to local women’s charities.",english,,,,,"morgan hendrix , ","alamo ritz , alamo drafthouse , d.c. , austin , dallas , alamo , ",,,,"jenavieve hatch warner bros , twitter twitter twitter  alamo , facebook , ",http://omgili.com/ri/jHIAmI4hxg8kBMzlsF_JTjQdlO8_P5DHS7vvZzrbDOhtbiApETda4i__4kJa.Ygrfa4XdIWnfmqnSZZJLOq32JBYteHoqFqCJJR0HWJQvWXWRCZpb1dCW66WfQCVNDfTj8kxh9fm21deEN3GGb2qUJ.gSk0h7ozfjK8vdSmZgtanbwPQJdfnBSCh_sYfUeA9,Grown Men Upset By Movie Theater Offering Women-Only Screening Of 'Wonder Woman',http://www.huffingtonpost.com/feeds/news.xml,The Huffington Post | Full News Feed,2017-05-26T02:07:00.000+03:00,0,1,news,huffingtonpost.com,US,http://img.huffingtonpost.com/asset/1910_1000/592702bc2000003200cb2a53.png?cache=leilpa3gi8,0,
Daniel Marans,A Majority Of Senate Democrats Support Bernie Sanders' $15 Minimum Wage Bill,"05/25/2017 02:05 pm ET | Updated May 25, 2017 A Majority Of Senate Democrats Support Bernie Sanders' $15 Minimum Wage Bill Last time, just five of Sanders' colleagues were on board. By Daniel Marans 
A majority of the Senate Democratic caucus is backing a bill that would raise the federal minimum wage to $15 just two years after a comparable bill introduced by Sen. Bernie Sanders (I-Vt.) received scant support from his colleagues. 
Thirty of Sanders’ colleagues in the caucus joined the former presidential candidate in formally introducing the bill on Thursday, including Senate Minority Leader Chuck Schumer (D-N.Y.) and Sen. Patty Murray (D-Wash.), ranking member on the Health, Education, Labor and Pensions Committee. By contrast, just five senators co-sponsored Sanders’ 2015 bill raising the minimum wage to $15. 
Schumer and Murray announced their support for the bill at an April press conference. At the time, however, the bill enjoyed the support of 23 other senators ― just shy of a majority of the Democratic caucus. 
“The time is long overdue for us to raise the minimum wage, which is now, at the federal level, $7.25 an hour, which I think under any definition is a starvation wage,” Sanders said at a Thursday press conference on the bill’s introduction. 
“We have got to raise the minimum wage to a living wage,” he said. “And what we are here to say is that living wage is $15 an hour.” Mark Wilson/Getty Images Senate Minority Leader Chuck Schumer (D-N.Y.) is ""feeling the bern"" when it comes to the $15 minimum wage. 
Sanders was flanked by Senate and House co-sponsors, including House Minority Leader Nancy Pelosi (D-Calif.), as well as low-wage federal contract workers from Good Jobs Nation, an offshoot of the labor union-backed “Fight for $15” campaign. Reps. Keith Ellison (D-Minn.) and Bobby Scott (D-Va.), the ranking member on the House Education and Workforce Committee, are introducing an identical companion bill in the House. The bill currently has 153 co-sponsors, a large majority of the House Democratic caucus. 
Sanders was able to attract the support of party leaders and other more moderate colleagues by extending the phase-in period from 2020 to 2024, assuaging fears that a rapid increase would result in job losses. The largest hike in pay would occur right away if enacted, with the law lifting the federal minimum wage from $7.25 to $9.25 this July. 
The federal minimum wage has not gone up since 2009, when former President George W. Bush approved the last of several gradual increases. 
But after the Service Employees International Union launched the “Fight for $15” movement in 2012, a growing number of cities and states have adopted the $15 minimum, making it a major benchmark for progressive activists. Los Angeles, San Francisco, Seattle and the state of New York are all in the process of raising their minimum wages to $15. 
Of course, with Republicans controlling the White House and both chambers of Congress, there is virtually no chance that this legislation will be considered, let alone pass. Democrats are instead using the bill to show the public what they would do if they had power, with a particular eye on their restless progressive base, which would like to see the party embrace Sanders-style economic populism. Do you have information you want to share with HuffPost? Here’s how. ALSO ON HUFFPOST 2017 Scenes From Congress & Capitol Hill 2017 Scenes From Congress & Capitol Hill 2017 Scenes From Congress & Capitol Hill 1 66 Comey's Big Day Former FBI Director James Comey testifies before a Senate Intelligence Committee hearing on Russia's alleged interference in the 2016 U.S. presidential election on Capitol Hill on June 8, 2017. Share this slide: ",english,,,"bernie sanders , ",,"donald trump , sanders , bobby scott , murray , keith ellison , mick mulvaney , patty murray , daniel marans , chuck schumer , nancy pelosi , george w. bush , schumer , ","san francisco , new york , capitol hill , seattle , los angeles , ",,"majority of senate , minimum wage bill a majority of senate , ",,"congress , senate , service employees international union , labor and pensions committee , congress & capitol hill 2017 scenes from congress & capitol hill 2017 scenes from congress & capitol hill , education , house education and workforce committee , house , white house , budget queries office of management and budget , good jobs nation , house budget committee , ",http://omgili.com/ri/jHIAmI4hxg8kBMzlsF_JTjQdlO8_P5DHS7vvZzrbDOjbb2S1qXoYsz2eh4FYnc09qdYlXDvjr1W3ZsAjSWv2EgYaU0r6ScOZDMfWxLlH_wYsGMLBAhQxHYOBRSykLrRhNfO_EjQevh4Rw.pEkV20sSPNtix78P18mFhLyNPt3pM-,A Majority Of Senate Democrats Support Bernie Sanders' $15 Minimum Wage Bill,http://www.huffingtonpost.com/feeds/news.xml,The Huffington Post | Full News Feed,2017-05-26T02:05:00.000+03:00,0,1,news,huffingtonpost.com,US,http://img.huffingtonpost.com/asset/1910_1000/5927114a2000003200cb2a94.jpeg?cache=e04mzupbed,0,
Claire Fallon,"Everything Is Exhausting Right Now, And Merriam-Webster Has The Perfect Word For Us","Everything Is Exhausting Right Now, And Merriam-Webster Has The Perfect Word For Us Inanition, the word that sums up everything about politics right now. By Claire Fallon Getty / Twitter 
For reasons of its own, the feisty dictionary Merriam-Webster decided to feature “inanition” as its word of the day on May 25, 2017. 
The noun describes “an exhausted condition,” more specifically “the exhausted condition that results from lack of food and water” or, secondarily, “the absence or loss of social, moral, or intellectual vitality or vigor.” Today's #WordOfTheDay is 'inanition.' Remember to stay hydrated. https://t.co/R8mN3mhMkm pic.twitter.com/pHss84VJWM 
Thanks to the online dictionary’s justified reputation as a sly political commentator and watchdog , followers were quick to see shade cast by the selection: @MerriamWebster MerriamWebster throwing so much shade I threw away my sunscreen — TNR Kitty (@TNRKITTY) May 25, 2017 @MerriamWebster So another way to say this would be ""low energy"", right? — Noah Neidlinger (@candor_for_sale) May 25, 2017 
Others made more direct political connections: @mea_mark @MerriamWebster I drink a lot of ice water. Given the rollback on the #EPA and clean air/water act .... this may become difficult. I miss Obama. ?? — Iterators (@IteratorsLLC) May 25, 2017 
Who knows what motivated Merriam-Webster to highlight “inanition” at this moment in history Thursday? We can only speculate. 
There’s certainly no confirmation that this feature was meant to tweak President Donald Trump for his reported belief that exercise depletes the human body’s finite reservoir of energy ; or for the claim that his “Islamic terrorism” dogwhistle during a recent speech was a flub (”he’s just an exhausted guy,” a White House official told CNN ); or for his previous criticism of Hillary Clinton as “low energy,” a claim which now strikes many as hypocritical . 
The list of possible reasons goes on: Maybe the featured word was random. Maybe it was intended to serve as a reminder to hydrate during the upcoming warm summer months. 
Maybe it was a wink of solidarity to those who feel fatigued by the constant flood of scandalous leaks coming from the White House and the repeated attempts by the administration and Congress to gut healthcare programs, environmental protection measures and other federal programs that many rely on for health and survival. 
One thing we do know, however, is what “inanition” means. Thanks, Merriam-Webster! Related...",english,,,,,"claire fallon getty , — iterators , donald trump , hillary clinton , obama , merriam-webster , — noah neidlinger , ","white house , ",,,,"congress , cnn , white house , tnr kitty , ",http://omgili.com/ri/jHIAmI4hxg8kBMzlsF_JTjQdlO8_P5DHS7vvZzrbDOgLZ4.gbxRvtErMdm.oZh8o1uEvSTFKUjmMml7xQq1WA9FG6kjbEU3BH9_JCUvXL3_4LyCl3BugaqC_o9vgc.Qv,"Everything Is Exhausting Right Now, And Merriam-Webster Has The Perfect Word For Us",http://www.huffingtonpost.com/feeds/news.xml,The Huffington Post | Full News Feed,2017-05-26T01:56:00.000+03:00,0,1,news,huffingtonpost.com,US,http://img.huffingtonpost.com/asset/1910_1000/59271189200000290016ee27.jpeg?cache=5khc3spzer,2,
