Author,Title,Text,Language,External Links,Mentioned Persons (positive),Mentioned Persons (negative),Mentioned Persons (neutral),Mentioned Persons (none),Mentioned Locations,Mentioned Organizations (positive),Mentioned Organizations (negative),Mentioned Organizations (neutral),Mentioned Organizations (none),Thread Link,Title,Section Link,Section Title,Thread Publication Date,Comments Count,Participants Count,Site Type,Site Name,Site Country,Main Image,Performance Score,Rating
Michael McAuliff,Trumpcare Scored So Badly It Could Actually Help The Senate,"05/25/2017 04:19 pm ET | Updated 1 day ago Trumpcare Scored So Badly It Could Actually Help The Senate Some GOP senators are so appalled by the House Obamacare repeal bill that they have little choice but starting fresh. By Michael McAuliff , Sam Stein 
WASHINGTON ― The health care bill crafted and passed by House Republicans received another poor score from the Congressional Budget Office on Wednesday evening, with officials estimating that the legislation would leave 23 million more Americans uninsured by the year 2026. 
But over in the Senate, where lawmakers are trying to create a health care bill of their own, the dismal analysis may actually offer Republican lawmakers a silver lining. Since it does nothing to ease concerns of more than a half-dozen GOP senators, it could encourage them to simply ditch the House plan in favor of a vastly different approach. 
“I like your optimism. I think that’s a very interesting perspective,” said Sen. Rob Portman (R-Ohio), who has put himself at the center of the main GOP working group trying to come up with a bill, along with the chairmen of the three relevant committees. That group of more than a dozen also includes conservative Sens. Mike Lee (R-Utah) and Ted Cruz (R-Texas). 
For weeks now, Republicans senators have been openly critical of having to deal with the House GOP bill. Their worries stem both from the dramatic cuts the House legislation makes to Medicaid expansion, and the insurance market reforms that would result in rising premiums for the elderly and fewer coverage protections for consumers at large. The CBO score, from their vantage point, validated those criticisms. 
“I always said we need to stay focused on one very important goal, and that is reducing costs, premiums,” said Sen. Steve Daines (R-Mont.), one of the House bill’s more conservative opponents. Daines said he includes older Americans and ill people among those who need affordable premiums, and according the the CBO analysis, many of those would no longer be able to buy coverage. 
For Portman, the House bill is downright catastrophic in that it would roll back the Affordable Care Act’s expansion of Medicaid, which is the single largest source of funding to combat the opioid epidemic ravaging his state. He needs to get conservatives like Lee and Cruz off the idea of curtailing that expansion. 
“That’s what I’m trying to do, is shift the discussion a little bit to, how do we continue to provide coverage?” Portman said. Bill Clark via Getty Images 
The reality that the House bill cannot win enough senators’ support at least offers a fresh opening for Portman, even among his conservative colleagues who want to wipe Obamacare entirely from the books. 
“I hope so. I hope so. I just don’t know if we can get the other folks” on the right, Portman said. 
One of the wild-card options boosted by the CBO’s tarnishing of the House bill is a measure written by Republican Sens. Bill Cassidy (La.) and Susan Collins (Maine). 
That legislation is not popular with conservatives, because it keeps the funding sources of Obamacare and lets states that like the Affordable Care Act keep it. But it also ends the hated individual mandate in favor of a system that allows automatic enrollment in insurance with the ability to opt out. How well it would work is debatable . But with the CBO affirming the House bill as a non-starter in the Senate, and Portman struggling to bring his conservative colleagues in his direction, the Cassidy-Collins option could emerge as the de-facto compromise. 
“That’s our hope,” Collins said. “We’ve had several good meetings with our colleagues and there’s a lot of interest, and I believe this does give us momentum to try to draft a different bill.” 
Whether the Senate GOP leadership will follow Collins’ lead is an open question. Majority Leader Mitch McConnell (R-Ky.) has said he will only rely on Republican votes, making his margin of error razor thin (he can stand to lose only two members). 
Because of that, lawmakers have had fits coming together on a proposal that would unite senators such as Collins, Portman and Cassidy, with those like Cruz, Lee and Sen. Tom Cotton (R-Ark.) ― another member of the GOP’s main working group. The CBO score of the House bill makes a fresh approach a necessity. But it doesn’t change the reality and challenges of the whip count. 
The “Senate was already committed to doing its own thing, had a good sense of what the score would say,” said one senior Senate GOP aide. “The challenge for Republicans is that the party doesn’t generally believe in forcing people to buy things they don’t like (and if you haven’t noticed, most healthy young people don’t like super pricey health care plans) and that makes it hard to get a decent CBO score.” ALSO ON HUFFPOST",english,,,,,,,,,,,http://omgili.com/ri/jHIAmI4hxg8kBMzlsF_JTjQdlO8_P5DHS7vvZzrbDOjwIGMdS_.vlEFa2b.JrATDEYv59Tg4VblXHthtcWhY_fHwhTkPqQrtrskkw0u1cWdRfJWRkjRHhg--,Trumpcare Scored So Badly It Could Actually Help The Senate,http://www.huffingtonpost.com/feeds/news.xml,The Huffington Post | Full News Feed,2017-05-26T04:19:00.000+03:00,0,1,news,huffingtonpost.com,US,http://img.huffingtonpost.com/asset/1910_1000/5927334c1600002200ddcdf6.jpeg?cache=5khqlhcqlp,5,
Cole Delbyck,We're Still Waiting For Jennifer Garner The Movie Star,"05/25/2017 04:17 pm ET | Updated 19 hours ago We're Still Waiting For Jennifer Garner The Movie Star She deserves better than playing the silent wife in ""Wakefield."" James Devaney via Getty Images Jennifer Garner signs autographs outside ""The Late Show with Stephen Colbert."" 
The role of wife and mother is something Jennifer Garner knows well. It’s one she’s played in her last seven consecutive films, an identity that’s boosted her cultural relevance over the past decade, as her on-screen career has taken a back seat to raising a family ... and, err, Ben Affleck . 
Films like “Juno” and “Miracles of Heaven” showed Garner making the most out of the “wife” character, delivering her best film performances to date, exploring the joys and challenges of motherhood. Similar roles in more forgettable fare (”The Odd Life of Timothy Green,” ”Alexander and the Terrible, Horrible, No Good, Very Bad Day” and “Danny Collins”) have fallen by the wayside. And the less said about “Nine Lives” the better. 
Those clamoring for a Garner comeback of a different sort won’t find much to celebrate in “Wakefield,” which opens for a wider release on Friday. Based off the short story by E. L. Doctorow , the film finds Garner playing wife and mother yet again, but the typecasting could be easily forgiven if the material was deserving. Director Robin Swicord, who’s made a career out of bringing women’s stories to the big screen, is at the helm of her first film in years. And yet here these identifiers overwhelm fleeting moments of agency, as Garner’s primary function is to service the evolution of a husband who’s, well, kind of an asshole. 
“Wakefield” belongs to Bryan Cranston as Howard, a man who essentially ghosts his wife Diana (Garner) and children by going on a faux “Into the Wild” quest to find himself. Except instead of traveling all the way to the Alaskan hinterlands, Howard sets up shop in the attic overlooking his house, as he watches his family cope with his disappearance and presumed death. Apart from a handful of flashbacks where Garner gels well with a more adult, edgier tone, her scenes are mostly silent, taking place behind the attic’s glass window pane and through a pair of binoculars. 
There’s a certain boldness in telling this story from the eyes of an unlikable protagonist, especially through the lens of a female director, and no one is better suited than Cranston to humanize an anti-hero. The film stays with Cranston’s character, even in his most arrogant and repulsive moments, as “Wakefield” is a deeply internal piece that strongly evokes its original source material. Exploring everyone’s perverse desire to pull the escape hatch on life is fascinating, but not allowing Garner a moment of respite under Cranston’s unrelenting gaze makes for a frustrating and far less dynamic experience. 
In a recent interview with Build Series, Swicord addressed these criticisms , agreeing that the story is the very “definition of the male gaze,” but claiming that the film ultimately subverts this power structure. There is something to be said about Swicord writing and directing a film that unapologetically empathizes with a middle-aged white male in crisis and not his wife. However, if her intention was to provide commentary on the ways men come to view women, she missed a crucial opportunity in the film’s ending to drive her point home. Jim Spellman via Getty Images Director Robin Swicord, actors Bryan Cranston and Jennifer Garner at the ""Wakefield"" premiere. 
While Howard lives in self-imposed destitution, dumpster diving for food and communing with the town’s local raccoon population, Diana is left to her own devices. She later strikes up a romance with Dirk (Jason O’Mara), an ex-boyfriend and former work rival of Howard’s. Through flashbacks, it’s revealed that Howard was only initially interested in Diana because of what amounts to a pissing contest between himself and Dirk. It’s disappointing to say the least that Garner’s character so easily volleys back and forth between the two and is none the wiser. 
Dirk’s encroachment on Howard’s so-called territory and an almost laughable come-to-Jesus moment during a rainstorm prompt him to return home months after disappearing. Before he walks through the door, however, Howard imagines the various reactions Diana and his family might have. In one scenario, they’re terrified, and in another, they break down crying. But before the audience is allowed to see her genuine reaction ― and a scene where she exists outside of her husband’s viewpoint ― the film cuts to black. The short story ends in a similar fashion, so the adaptation is nothing if not faithful, but the ending feels like a cop-out that unfairly robs the character of any semblance of justice. 
Curiously, “Wakefield” was filmed during the nearly one-year period after Garner and then husband Ben Affleck announced their separation . The actor was painted by the media as a philanderer in the midst of a mid-life crisis (see: fake phoenix back tattoo ), while Garner held down the fort, shuttling kids back and forth from karate class. That’s why it’s somewhat baffling that given the material’s fascination with a husband’s failings, Garner chose to work on this project before eventually divorcing Affleck this April . Jim Spellman via Getty Images Ben Affleck and Jennifer Garner in one of their final red carpet appearances as a couple. Close 
Spilling the tea 24/7. Never miss a beat. Learn more Newsletter",english,,,,,,,,,,,http://omgili.com/ri/jHIAmI4hxg8kBMzlsF_JTjQdlO8_P5DHS7vvZzrbDOjyPSVW7fbXpgHQXN11096VWmgy50VOPAzxC5aidgmAu8FrU7zNo0GOru4ly1pr2DegeXeAHTfzUPn41nMK7OJyUuy71bV1oyk-,We're Still Waiting For Jennifer Garner The Movie Star,http://www.huffingtonpost.com/feeds/news.xml,The Huffington Post | Full News Feed,2017-05-26T04:17:00.000+03:00,0,1,news,huffingtonpost.com,US,http://img.huffingtonpost.com/asset/1910_1000/592736151600002200ddcdfb.jpeg?cache=hoqsmyu3gs,3,
Laura Barron-Lopez,Some Republicans Blame Liberals And Journalists After GOP Candidate Body-Slams Reporter,"05/25/2017 04:09 pm ET | Updated 14 hours ago Some Republicans Blame Liberals And Journalists After GOP Candidate Body-Slams Reporter Multiple GOP lawmakers said they've thought about attacking reporters themselves from time to time. By Laura Barrón-López 
WASHINGTON ― Apparently, you can body-slam a reporter for asking a question and still have a place in the Republican Party. 
Greg Gianforte, the Republican candidate running for Montana’s open House seat in the state’s special election, was charged with misdemeanor assault late Wednesday after he attacked Ben Jacobs, a reporter for The Guardian who’d gone to Montana to cover the special election there. 
The incident happened the day before the vote, and Gianforte hastily pulled out of previously scheduled interviews on Thursday. Back in Washington, D.C., House representatives leaving a final meeting before a weeklong recess avoided weighing in on the incident by insisting that Montana voters would decide who represents them in the Congress. Others tried to downplay the seriousness of the matter by making jokes about the media’s culpability. Rep. Duncan Hunter said of MT reporter assault, “It’s not appropriate behavior. Unless the reporter deserved it.” — Mary Clare Jalonick (@MCJalonick) May 25, 2017 
Others provided rationalizations for the attack. 
“The actual act of what he did, there’s just no way to justify that,” said Rep. Trent Franks (R-Ariz.), who then shifted blame onto liberals. “I understand the frustrations that people feel because we can’t hardly go to a town hall without it just being a total denial of free speech. The left has created enormous polarization in this country.” 
The reaction from elected Republicans to the Gianforte incident reflects the odd, cynical tensions that have come to paralyze some in the Republican Party. Forced to contend with their base’s profound distrust of the press ― along with the fact that their party nominated and helped elect a president who encouraged violence against journalists ― they’ve chosen to soft-foot any shock they may have felt over an actual incident of a reporter being assaulted. 
On Wednesday night, Jacobs was asking Gianfonte about reaction to the latest Congressional Budget Office score for the House-passed bill to repeal and replace the Affordable Care Act. The Montana Republican “ grabbed Jacobs by the neck with both hands and slammed him into the ground” before punching the reporter, according to an account published by Fox News reporter Alicia Acuna, who was in the room. 
HuffPost asked nearly a dozen lawmakers about the CBO score on Thursday. No one threw any punches . 
And yet, when asked why Gianforte couldn’t show any such constraint, many of these lawmakers expressed disappointment with the reporters themselves. 
“What’s your question, do I think body slamming reporters is a good thing?” Rep. Mac Thornberry (R-Texas) said, laughing at reporters. “Ya’ll really are into this.” 
Some even admitted ― jokingly, one presumes or hopes ― they’ve imagined assaulting a reporter themselves from time to time. Sen. Jeff Flake (R-Ariz.) said there’s no excuse for Gianforte’s actions “ as much as we’ve all thought about it.” 
To a large degree, House GOP leadership has their hands tied when it comes to Gianforte. If he wins, they could deny him prime committee positions. But there is little practically that they can do ― should they want to ― to prevent him from being seated. Speaker Paul Ryan (R-Wis.) said Gianforte “ should apologize , ” but didn’t go so far as to call on the candidate to withdraw from the race. Others declined to express discomfort with the possibility that their newest colleague will have been so recently charged with assault. 
“We’ll see what the election shows,” Thornberry quipped, when pressed on whether he’s OK with serving alongside Gianforte. 
Out of those who spoke with HuffPost, the harshest comments came from Reps. Mark Sanford (R-S.C.) and Tom Cole (R-Okla.). 
“The action is unacceptable, it’s incumbent upon all of us to call an ace and ace,” Sanford said. “Physical violence is not the hallmark of an open society and we can disagree with each other at a visceral and gut level, but you don’t take it to the point of physical contact. He crossed that line.” 
Cole said there’s “no excuse” for what Gianforte did. 
“I suspect it will have electoral consequences,” Cole said. “That’s not the way to get off on the right foot around here.” 
Still, neither Cole nor Sanford said Gianforte should end his campaign. The election will wrap up later Thursday night in Montana. Related Coverage ",english,,,,,,,,,,,http://omgili.com/ri/jHIAmI4hxg8kBMzlsF_JTjQdlO8_P5DHS7vvZzrbDOi9Xt.Q.MAcZBuyjIIAvNbtk9SnnKijXHFbQ4aw2wn5SVHuOS53vS.2LYSL_uKSyRe7dznf1HSdt_B1Ip9CWZdi,Some Republicans Blame Liberals And Journalists After GOP Candidate Body-Slams Reporter,http://www.huffingtonpost.com/feeds/news.xml,The Huffington Post | Full News Feed,2017-05-26T04:09:00.000+03:00,0,1,news,huffingtonpost.com,US,http://img.huffingtonpost.com/asset/1910_1000/59272e981600002100ddcdd9.jpeg?cache=csspvjxoyd,0,
Sarah Ruiz-Grossman,You Don't Have To March To Be In The Resistance,"05/25/2017 04:06 pm ET | Updated 4 days ago You Don't Have To March To Be In The Resistance Many people with disabilities are joining the fight online. By Sarah Ruiz-Grossman 
In the wave of activism that has swept the country since President Donald Trump’s inauguration, people have found myriad ways of expressing their discontent ― from attending marches and rallies, to making calls to Congress, to showing up at town halls . 
But there’s one form of activism that cannot be swept aside if the resistance is to be truly inclusive, specifically of people with disabilities: online activism. 
While social media is critical to today’s social justice movements , people often dismiss online activism as “ hashtag activism ” or “ slacktivism ,” painting it as less valuable or committed than showing up in person, say, at rallies or marches. 
But often missing from that debate is the perspective of people with disabilities. Disabled people represent 10 percent of the world’s population , and for their community, social media is often a critical way ― at times the only way ― to take part in social movements. 
“I’m a disabled person whose activism is primarily online,” disability activist Alice Wong, who co-started the hashtag #CripTheVote , told HuffPost via email. “Living in a world that is physically and socially inaccessible (e.g., micro-aggressions, lack of transportation, lack of accessible buildings and venues) and living with a body that has significant energy and assistance needs, makes it difficult for me to ‘show up’ the way most activists imagine what ‘showing up’ means .” Alice Wong Alice Wong, founder of the Disability Visibility Project and co-partner in #CripTheVote, research consultant, disability activist based in San Francisco. 
Leading activists and groups in today’s social justice movements can often sideline people with disabilities, likely without even realizing it. 
Last week , for instance, celebrity America Ferrera led a panel, hosted by Twitter and Cosmopolitan as part of her activism group Harness , called #ActivismIRL ― or Activism “In Real Life.” Featuring Women’s March and Black Lives Matter leaders, the panel discussed how to “ turn hashtags into action ” and learn about taking action from so-called “frontline” activists. 
While the panel brought up important points, seeking to teach people who may be new to activism how to engage more deeply in today’s social movements, several people in the disability community also pointed out on Twitter that the event’s #ActivismIRL hashtag seems to draw a false ― and even harmful ― dichotomy between online activism and activism “in real life.” Right now we need every kind of activism & resistance. The notion one is more real is a hoax to divide our power #ActivismIRL #CripTheVote — alice wong (@SFdirewolf) May 19, 2017 @AmericaFerrera For some with disabilities... #ActivismIRL means spreading awareness through social media. I attended a function at the WH via robot! — Dominick Evans (@dominickevans) May 19, 2017 #ActivismIRL is bugging me for reasons beyond the doubleshot of erasure & ableism it applies to online activism of disabled activists. /1 — Gregory Mansfield (@GHMansfield) May 19, 2017 
“Hashtags like #ActivismIRL devalues the labor ― and it’s real labor ― of online activists like myself. We’re present and visible, but in a different way,” Wong told HuffPost. “It’s also pretty ableist when you consider the privilege involved in being ‘in real life.’ Not all people have the ability to travel or the requisite time/resources for frontline activism.” 
Harness, as well as to Ferrera’s public relations team, did not immediately respond to requests for comment. Chris Helgren / Reuters 
With the Trump resistance going strong ― April showed a sharp increase in protest activity , and people are getting active online with hashtags like #IAmAPreexistingCondition ― movements are losing out on engaging millions of people when they don’t work to include those with disabilities. 
“I have a progressive neuromuscular disability, and I spent years fighting for equipment that even allows me to get out of bed,” Dominick Evans , media advocate for the Center for Disability Rights, told HuffPost. “I have so much education and information to share with the world, but if I can’t leave my house because my wheelchair doesn’t work, how do I disseminate that?” 
In the current debates around policy, people often think of health care as the critical issue for disabled people. While this is important, t he disability community ― like any community ― is intersectional , including people of all ages, races and religions. That means that issues like education , affordable housing and police brutality can be “disability issues .” 
“The disability community is the canary in the coal mine of public policy: We are usually the first group targeted because of ableist policies that imply that in accessing our rights, we are asking for something extra, which is simply not true ― we are asking for equality,” disability activist and former Obama appointee Rebecca Cokley told HuffPost by email. “ The reality is, we are being impacted, as in the case of Medicaid cuts , increasing funding of vouchers and charter schools , repeal of the protections tied to pre-existing conditions .” Spencer Platt via Getty Images Alba Somoza, who has cerebral palsy, attends a rally with her mother and dozens of health care activists in front of a Harlem charter school before the expected visit of House Speaker Paul Ryan. The activists are critical of Ryan and the passage of the GOP healthcare bill in the House. 
When it comes to responding to political issues with activism, it’s not just those with physical disabilities who can be limited in their ability to participate in person ― so can people with chronic illnesses, mental health issues and other disabilities. 
“I went to my first protest march in Miami on Inauguration Day,” 18-year-old activist Kayla Alamilla told HuffPost in February . “Before then, my depression and anxiety had prevented me from going out and protesting.” 
While today’s leading resistance movements often make an effort to include people with disabilities ― the Women’s March, for instance, had a Disability March website for people to join the Jan. 21 events online, and Black Lives Matter lists disability rights as a priority on its site ― organizations can always do more, according to Wong. 
Valuing and respecting online activism is one part of improving inclusion. Equally important, Wong said, is incorporating people with disabilities in every part of a social movement, from initial planning, to leadership positions, to organizing event access. 
“Almost every group can improve the way they include disabled people in their movements. I’d like to see disabled people present in all movements who are in leadership positions with actual power, not tokens,” Wong said. “Many movement leaders have to be convinced or persuaded to consider disability as diversity when it should be the default.” 
If you want to learn more about activism and social justice issues directly from people with disabilities, check out hashtags #CripTheVote , #AccessibleOrganizingMeans and #DisabilitySoWhite . ALSO ON HUFFPOST Mom Takes Empowering Photos Of Kids With Disabilities Mom Takes Empowering Photos Of Kids With Disabilities Mom Takes Empowering Photos Of Kids With Disabilities 1 ",english,,,,,,,,,,,http://omgili.com/ri/jHIAmI4hxg8kBMzlsF_JTjQdlO8_P5DHS7vvZzrbDOidciPqihXkPG2gFOUEf.AVGA4HQVqf9RE0D.q03buqbtqKCbYyBfHeL1REvyU83HMK9y_vAc4LEyaacloEZDcrffRoj30N249I40E0FTSrig--,You Don't Have To March To Be In The Resistance,http://www.huffingtonpost.com/feeds/news.xml,The Huffington Post | Full News Feed,2017-05-26T04:06:00.000+03:00,0,1,news,huffingtonpost.com,US,http://img.huffingtonpost.com/asset/1910_1000/592710782000003200cb2a91.jpeg,0,
